73050:45,"especially, you know, if you catch yourself short on cash ///OR/// if you're on vacation, it's just easier to put everything on a card.",VP,,,,,,,
30197:23,it would average out to thirty-five ///OR/// forty dollars a night whichb is a reasonable rate.,Num,,,,,,,
137591:36,"they've won, like, i think six ///OR/// seven in a row now,",Num,,,,,,,
6625:69,"i, i, i guess, in my own, having had the whole three ///OR/// four minutes to, you know, give it a great deal of thought, you know, um, i, i think i agree with you one hundred percent about it being some sort of voluntary,",Num,,,,,,,
46988:18,"i got off my pace ///OR/// my cordless phone,",NP,,,,,,,
97004:55,"because, uh, i, i guess i placed all but one ///OR/// two of my calls. and, uh, only because i going to make some money,",Num,,,,,,,
6194:35,"so. i don't know if you participate in that ///OR/// not,",OrNot,,,,,,,
150670:77,"well, i remember back during the, uh, during the war, everyone here at work always had the radio ///OR/// the t v on, because that, they were going constantly with that stuff.",N,,,,,,,
29159:97,"and, uh, i talked to a thirteen year old last night who's, uh, goes to, uh, one of the plano high schools ///OR/// junior highs, i guess,",NP,,,,,,,
56988:61,"perhaps that would be a solution if they were required to vote at least for their first three ///OR/// four years after they become of voting age. required to register and vote for four years,",Num,,,,,,,
10846:33,i wonder how truthful all of that was ///OR/// whether there was fiction.,Sentence,,,,,,,
176508:24,i think it takes about three ///OR/// four times before it gets easy.,Num,,,,,,,
86950:15,"but, the legal person ///OR/// lawful person should not be penalized because there is the criminal element.",AP,,,,,,,
102464:49,sometimes i think we pay the baby-sitter as much as paying for their dinner ///OR/// lunches,N,,,,,,,
150048:18,i've had two ///OR/// three of those go out.,Num,,,,,,,
72175:60,"i'm, i guess i probably put on about ten, nine ///OR/// ten pounds, since i stoppedb playing, whiche was about four years ago.",Num,,,,,,,
143964:138,"i think if it's, uh, if it's a con-, if it's a convicted, uh, felon on parole uh, and he goes out and, and commits another crime ///OR/// kills somebody, i, you know, i, i feel the same way,",VP,,,,,,,
25323:87,"um, one of the remarkable things about the weather in the summertime here is that quite often the average daytime high of say ninety-nine degrees is within five ///OR/// six degrees of the all time record high.",Num,,,,,,,
105461:58,"it wasn't like the newer ones that have nice chambers that keep it afloat ///OR/// keep it, uh, upright again.",AP,,,,,,,
46782:51,"i mean it looks, i guess, kind of like, uh, the chevy aerostar ///OR/// arrow,",N,,,,,,,
54761:52,"it was on one of the networks, i think last weekend. uh, ///OR/// two weeks ago.",Adv,,,,,,,
4682:83,"but, um, it's very frustrating. and, even, even with health food stores and stores where you can buy natural products or, uh, organic, you know, materials, and foods and things.",NP,,,,,,,
13665:45,i couldn't remember in tigon had purchased g t e --s phone mail services ///OR/// if g t e had purchased tigon.,VP,,,,,,,
120770:23,and he had it for about three ///OR/// four years where we just about had to lift him and carry him every place he went.,Num,,,,,,,
29361:19,they will have maybe two ///OR/// three main stories and just spend a very large amount of time.,Num,,,,,,,
54841:46,"do you go by the adsf when you look at thema, ///OR/// the reviews.",N,,,,,,,
149373:37,"you know, i saw something on c n n ///OR/// on cable here a while ago that showed some people that had rabbits in apartments and in houses,",NP,,,,,,,
157431:41,i'm not going to work any harder and make any more ///OR/// create any more jobs.,VP,,,,,,,
162444:31,"uh, d c around here stands for drug capital ///OR/// death capital.",AP,,,,,,,
150122:69,"uh, i would say the medical, uh, group insurance area as far as, uh, covering medical costs for yourself ///OR/// family members.",NP,,,,,,,
145001:59,"but there's still a, an, an inequality in the work forces ///OR/// jobs.",NP,,,,,,,
72563:57,"for some reason it seems to interest me, like people that make a big comeback or, you know, orel hershiser, things like that.",NP,,,,,,,
19308:17,will there be a union ///OR/// not.,OrNot,,,,,,,
165055:25,but then again you look at a ford ///OR/// especially a chevy,NP,,,,,,,
133415:190,"um, i'm not really, uh, sure that i even understand why the administration is proposing, for instance, tax reductions, because it seems to me that if, if, if they're talking about reducing, uh, the tax that needse to be paid, ///OR/// the tax that's currently being paid, then that can't, it seems to me it can't possibly, you know, help with the, the deficit picture.",VP,,,,,,,
150405:11,but now bench ///OR/// step aerobics have kind of taken over.,NP,,,,,,,
24757:57,"even a bad school is a good school up here, where, if i lived in new york city ///OR/// washington, d c, uh, i would seriously consider moving if i had a child.",NP,,,,,,,
166635:51,"but, uh, i don't know if that's been challengedb in the courts ///OR/// not.",OrNot,,,,,,,
129837:27,"and just depending on whether you say yes ///OR/// no, uh, you, you can give him capital punishment",Adv,,,,,,,
97709:59,"and i will probably be going back to work around january, whereas she will be about, eight ///OR/// nine months old.",Num,,,,,,,
105245:83,"but, the other thing that i thought of on this is, i wonder if there isn't enough money, uh, in our economy ///OR/// in our system.",N,,,,,,,
97699:27,"and she's just started that like yesterday ///OR/// the day before,",NP,,,,,,,
47298:37,"and then the nights are reasonably warm, you know, sixties ///OR/// seventies.",Num,,,,,,,
30178:66,"and whe-, when i finally got over there, it had fallen, uh, two ///OR/// three francs to the dollar.",Num,,,,,,,
129876:44,"i mean, i don't know whether i'd stay in prison ///OR/// not",OrNot,,,,,,,
169940:25,"there's nothing, maybe a picture ///OR/// two that belongs to that person",Num,,,,,,,
153470:46,"so, we are on a schedule where i try every, uh, three ///OR/// four years to, to buy a new one.",Num,,,,,,,
145555:164,"if you've got a pretty good rating, uh, credit rating you can call your in-, you know, your, your card, wherever you got your card from and tell them, hey, either drop my rates ///OR/// drop my, you know, uh annual fees",NP,,,,,,,
80247:17,"was it for health, or, to look good.",PP,,,,,,,
56013:64,"there definitely would have to be a major p r campaign in each community, each county, uh, parish ///OR/// however the state was divided up.",NP,,,,,,,
137750:18,there is only about five ///OR/// six options.,Num,,,,,,,
83258:73,"when i have heard about england's elections, they are allowed to run for what, a total of six ///OR/// eight weeks. even for the higher offices in the, in the land.",Num,,,,,,,
26907:20,did you teach in all subjects ///OR/// in all grade levels,NP,,,,,,,
170713:59,"do you know anyone that, uh, is, is in a nursing home ///OR/// has ever been in one.",VP,,,,,,,
72352:13,"believe it ///OR/// not though the, all the women that stay home are real busy when they are home.",OrNot,,,,,,,
76508:96,"they seem to be burdening the school system more and more with problems, any problems that a child might have, whether it's actually a school related thing ///OR/// not",OrNot,,,,,,,
150350:31,"do you do, uh, any anaerobic type, weight lifting ///OR/// weight training type exercise.",VP,,,,,,,
140027:33,"i guess we didn't have it high enough ///OR/// he didn't get hit in just the right spot,",Sentence,,,,,,,
121188:35,it's what they've done in the spring ///OR/// the fall.,N,,,,,,,
14253:43,"i wondered if it would help you sometimes fill in the gaps ///OR/// recognize discrepancies that other people, people like myself might not pick up on.",VP,,,,,,,
162718:32,"it was always my impression that the justice himself, ///OR/// herself, had the final say.",N,,,,,,,
86874:94,"but, you know, any kind of handgun at all, if it will fit in a handgun and a rifle you would still have to buy it, ///OR/// sign up for it,",VP,,,,,,,
62367:43,"but say, i think bangladesh would have been a good example ///OR/// some, some really desperate situation",NP,,,,,,,
76731:61,"and, so, i mean, you have to find out whether there's a legitimate reason, ///OR/// whether this is a warning signal.",NP,,,,,,,
66023:36,"it was like only, it was either sixty percent ///OR/// forty percent, go to college.",Num,,,,,,,
91263:36,but i think you can get a good education at public ///OR/// private,AP,,,,,,,
74049:29,"he used to go back twice ///OR/// three times a year, you know, because he missed it.",Num,,,,,,,
145063:39,and hers was the only income we had for three ///OR/// four months,Num,,,,,,,
131692:34,"they'd leave work and go to a golf course, ///OR/// a little country club they belonged to back in richmond, virginia and just, uh, play nine holes of golf.",NP,,,,,,,
27828:55,"our generation was, uh, so in tuned to music of that time that we identify goodness ///OR/// badness with, uh, things now with the music that's behinds them.",N,,,,,,,
124658:85,"it's hard to put the finger on, uh, what's worse, you know, the acid rain situation ///OR/// the ozone depletion, um, with, uh, your hydrocarbons, uh causing the damage in which,",NP,,,,,,,
152640:26,"and when you send it to washington ///OR/// send it to your state capitol, uh, a lot of it stays there",NP,,,,,,,
45877:58,"because e-, everything, i mean anything that tom landry wanted ///OR/// had, he was going to change it.",VP,,,,,,,
35519:24,"oh, i'm thinking around twenty ///OR/// twenty-five dollars.",Num,,,,,,,
152622:62,"uh, my, my opinion of taxes is that we just send money to washington ///OR/// to the state and they say they are going to send some back,",NP,,,,,,,
161207:19,"because somebody has a child or, uh, likes children doesn't really mean that they're qualified to give the child the kind of supervision and training that that, uh,",VP,,,,,,,
92652:59,"it looks like, it looks like it might be one of these seven ///OR/// eight year run things. where you kind of can spend your whole career on one show.",Num,,,,,,,
128817:104,"i, i'd also advise them that, uh, if mom and dad paid for their college, that, uh, if they decided to drop a course ///OR/// decided that they need another year, then they'd have to get a loan to continue.",VP,,,,,,,
70908:13,our first fifteen years ///OR/// eighteen years of being married nothing worked.,Num,,,,,,,
46142:88,"it was right close to when we was going to find out if we was going to get to be in the playoffs, ///OR/// not.",OrNot,,,,,,,
68972:52,"i, you know, go to cleveland to see them play, the indians ///OR/// the red sox,",NP,,,,,,,
138388:14,"she was four, ///OR/// three,",Num,,,,,,,
95915:62,"and you sometimes wonder when these people protest so much whether they're really concerned about their rights, ///OR/// whether they're really concerned about something else.",NP,,,,,,,
7017:103,"well the, the other thing some people are not aware of, is they will use their a, their credit card like their visa ///OR/// their mastercard for cash",NP,,,,,,,
170776:46,"if, if you can take care of yourself at all ///OR/// have someone that can take care of you, then you stay where you aref.",VP,,,,,,,
46012:28,"i can't remember whether we played three ///OR/// four quarterbacks,",Num,,,,,,,
76530:72,"uh, and you can't expect in a classroom for a particular course an hour a day to counteract, uh, sixteen ///OR/// seventeen years of influence at home.",Num,,,,,,,
34104:22,you can make it either tight ///OR/// as loose as loose can get.,AP,,,,,,,
142117:49,"and i even had, uh, i guess it wasf last year ///OR/// the year before, i had some out",AP,,,,,,,
62411:39,and i don't think you could have done it fifty ///OR/// a hundred years ago either.,Num,,,,,,,
75196:18,"she woke up about three ///OR/// four o'clock in the morning, water dripping from hers.",Num,,,,,,,
95254:54,"and i couldn't just, you know, wait for eight, three ///OR/// four months and then bring them back to her",Num,,,,,,,
42766:91,"because i started shooting, my dad started letting me shoot like a little air b b gun, when i was probably five ///OR/// six years old.",Num,,,,,,,
55759:30,i think i have gone home maybe once ///OR/// twice slightly sore.,Num,,,,,,,
129330:26,"but, unemployment now in dallas, ///OR/// in texas is up around six point,",N,,,,,,,
20453:61,"and it will, if have you a thirty year note, it will take like seven ///OR/// plus years off of your note.",Num,,,,,,,
123090:99,"i think, uh, it's in everyone's nature to some degree to want to get out and explore something they haven't, ///OR/// experience something, you know, indifferent.",VP,,,,,,,
362:41,"that's just a matter of defining priorities, i guess ///OR/// some priorities anyway.",NP,,,,,,,
8347:26,and they're good for about five years ///OR/// four years,Num,,,,,,,
175450:86,"and, and, but of course most time, most of the time management has a hard time distributing ///OR/// getting the word out to the people who must know.",VP,,,,,,,
52656:78,"and, and go ahead and get the punishment phase out of the way, because it doesn't do the criminal ///OR/// the victim's family, r-, r-, any of us, the taxpayer any good to have him sitting around for months and years.",NP,,,,,,,
14292:63,"um, and it's one of those that i can ei-, read either an article ///OR/// a couple of pages of those brief excerpts in the time frame that i'm going to spend in there.",NP,,,,,,,
164667:49,"and it's just sort of a, you know, four ///OR/// five pages that covers what's going on in plano.",Num,,,,,,,
132821:30,"but, uh, it'll go up to fifty ///OR/// sixty almost.",Num,,,,,,,
122735:37,and the other schools were built back in maybe the fifties ///OR/// early sixties,,,,,,,,
123672:38,"somebody said, you know, you're either a stranger ///OR/// a fool to try to predict texas weather,",,,,,,,,
4799:38,and they're still let out on the street after one ///OR/// two years.,,,,,,,,
71717:36,i don't know if you have had that problem there ///OR/// not.,,,,,,,,
24807:72,or if you're going to go the science route you can go to a target school that specializes in science ///OR/// art.,,,,,,,,
34018:36,"uh, my gun hasn't been shotf in a year ///OR/// two.",,,,,,,,
9412:60,"it's, it's not, not that it's just hot ///OR/// dry,",,,,,,,,
139019:32,"it's not as humid. as houston, say, ///OR/// atlanta,",,,,,,,,
154689:23,i only do it probably two ///OR/// three times a week.,,,,,,,,
17758:53,"i haven't decided whether, whether i want to play yet ///OR/// not",,,,,,,,
86671:25,"actually i paid about either a thousand dollars ///OR/// a little bit,",,,,,,,,
50680:36,"what do you think about the, uh, peace corps ///OR/// public service commitment.",,,,,,,,
173549:65,"of course, if he's fallen in love with drugs and there isn't anything but getting stoned ///OR/// high is, is the only thing in life that seems to be meaningful, then maybe there is no hope.",,,,,,,,
152368:30,"you probably have a better team, uh, cooperation, ///OR/// team playing, atmosphere.",,,,,,,,
102220:49,"that sounds like not as recent social changes, too, like back to the sixties ///OR/// fifties, i guess.",,,,,,,,
84467:25,and is sold as purple buddy ///OR/// sometimes sold as straw flower.,,,,,,,,
79690:66,"but now i think there are tests that can be conducted, uh, to tell whether ///OR/// not the puppies have the, have it.",,,,,,,,
143084:47,"like, would you go over and spend a lot of time in one place, ///OR/// travel to whole bunch of different places in one week.",,,,,,,,
1147:55,have you ever gotten one of those calls that is either generated by a computer ///OR/// somebody going down a list,,,,,,,,
1200:36,"but if they're going to offer these services, ///OR/// these recorded message, everything, they ought to be stuck working with the phone book like everybody else instead of using a computer to go through and just go down every sequence of numbers for this certain area code and call them.",,,,,,,,
39230:62,"but with little ones, i'd be kind of scared, to get anything that has teeth ///OR/// claws.",,,,,,,,
102655:14,"uh, a waitress ///OR/// waiter that waits the table, it's nice that they're attentive",,,,,,,,
57886:97,"i-, it frustrates him because of the support that they have and the support that the vietnam vets did not have, from the people ///OR/// the administration, either one.",,,,,,,,
93263:156,"i, i wonder how, how you instill in people the necessity for doing just a little bit extra to, to make this whole thing work. i mean, the extra like washing out bottles and jars, ///OR/// the extra of actually, uh, making sure that, uh, you take stuff over to, you know,",,,,,,,,
31292:58,"and i keep thinking, you know, gifted is, is einstein or, you know, uh, musical prodigies.",,,,,,,,
99475:12,i visited once ///OR/// twice.,,,,,,,,
57956:30,"uh, you know whether it was justified ///OR/// not, i know, that they probably felt like we were going in for a good cause.",,,,,,,,
170074:84,"and it, that i, i don't know if i ever went as far as three months ///OR/// not i-, i-, in keeping that kind of data.",,,,,,,,
130040:62,"well, i found out after washing out many a peanut butter jar that they're not a recycling number one ///OR/// two.",,,,,,,,
54645:43,"you see it for, uh, you know a couple of hours ///OR/// an hour",,,,,,,,
106579:87,so. it became dangerous for us to keep transporting her back and forth in the car because she was so wobbly and needed a walker ///OR/// a wheel chair,,,,,,,,
173411:18,and then they have naps ///OR/// rest period.,,,,,,,,
94302:19,"well, get a towel ///OR/// go change.",,,,,,,,
59616:52,and it doesn't matter what restrictions you put on that type of weapon ///OR/// a class three firearm.,,,,,,,,
174625:55,"if i, if i elicit good behavior i'm out in maybe five ///OR/// ten.",,,,,,,,
134089:60,"and they do post, uh, uh, warnings for people who have, uh, heart diseases ///OR/// respiratory problems during that summer season.",,,,,,,,
168438:37,"i've never had a, a punishment ///OR/// a, a crime like a murder touch my immediate family",,,,,,,,
35654:67,"but, you know, that's a sign that i'm going to have to do something sooner ///OR/// later.",,,,,,,,
133392:61,"um, short term, i don't think anything's going to be done about it ///OR/// probably should be done about it.",,,,,,,,
93867:26,"but if it's like a social activity ///OR/// a recreational activity, i don't mind",,,,,,,,
37770:39,"but i wouldn't want to go teach high school ///OR/// junior high,",,,,,,,,
63853:64,"i don't know how, how soon they're going to do it, ///OR/// how organized it's going to be,",,,,,,,,
31580:134,"i mean, he, he puts himself in the hospital fairly regularly thinking that, you know, he, he's not sure if he's going try to commit suicide ///OR/// not.",,,,,,,,
106103:34,and he left it up to me if i worked ///OR/// not.,,,,,,,,
33778:41,do you like to exercise because you want to ///OR/// because you have to.,,,,,,,,
134049:25,"i think i've bought one ///OR/// two new cars in my life,",,,,,,,,
171916:24,"you go, you know three ///OR/// four hours before the game.",,,,,,,,
109764:99,"oh, when we first were, were here, it was like we'd take maybe a, oh, a grocery sack full ///OR/// maybe two grocery sacks full,",,,,,,,,
30997:16,"i read about one ///OR/// two thick novels like that a year. you know,",,,,,,,,
70078:22,"have y'all been having any heat waves ///OR/// like the ninety degree,",,,,,,,,
54571:48,a lot of things we try to catch like at the dollar theater ///OR/// matinees,,,,,,,,
145702:45,"and, and they always have, you know, two ///OR/// three new onesf to adde to the list, you know,",,,,,,,,
58315:64,"but human nature being such as it is, i would think it would take, probably, two ///OR/// three years before people co-, could completely cut the cord.",,,,,,,,
75880:7,you ///OR/// the insurance companies never see any of that money.,,,,,,,,
170249:63,"you know. because it's not a person's fault that, you know, people not buying ///OR/// businesses are, are not on the up and up all the time, you know.",,,,,,,,
173510:113,"well, it seems like, well it, it seems as if in the past typically there have been a lot of cases of people being wrongly tried ///OR/// wrongly punishedb,",,,,,,,,
162665:33,i don't know if i'm making any sense ///OR/// not.,,,,,,,,
91264:39,"but i think you can also get a bad education at public ///OR/// private, you know,",,,,,,,,
83455:205,"uh, i think that the judges should be leftd to do most of the sentencing, simply because, uh, there is always, uh, there is, there is always a jury that might be swayedb, uh, by the moment, uh, to either to be too lenient ///OR/// too vengeful, i guesse.",,,,,,,,
110657:88,"i just, i just don't think there's a place in our environment, you know in the work force for drugs, ///OR/// alcohol either.",,,,,,,,
18182:39,"i mean just, just scratching two ///OR/// three inches was just a chore.",,,,,,,,
66676:23,"now whether they finally got it ///OR/// not, i don't know.",,,,,,,,
90762:42,"um, i, i was talking to somebody recently ///OR/// read somewhere where they, where they said that, you know, these children, they, they had to be the best,",,,,,,,,
85973:53,"i mean that was one thing, that came out of it, good ///OR/// bad,",,,,,,,,
106753:24,"did you have, uh, one coat ///OR/// two.",,,,,,,,
11797:36,"and, uh, i don't know whether that's bad ///OR/// good,",,,,,,,,
95445:55,"we use it more for just writing programs when we need to or, um, doing research, looking at the speech signal and then doing writing, and also as a just as a terminal,",,,,,,,,
111321:31,but a lot of their classes there were only eight ///OR/// ten children in their classes,,,,,,,,
103930:153,"you know, that's, that's scary because, you know, i'm not sure, i think we're paroling them without even knowing if they're, you know, goingb to be committing any more violent acts ///OR/// not.",,,,,,,,
163926:23,you going to get ten ///OR/// fifteen bucks for it,,,,,,,,
122138:110,"um, huh. well, i don't like it when, uh, people listen to my phone conversations, like if they're outside my door while i'm talking in my room, ///OR/// when people like look through my things in my bedroom.",,,,,,,,
127327:49,"i wonder how they're going to get through the winter. food wise ///OR/// any wise,",,,,,,,,
59184:37,"i mean, they may let you off for a day ///OR/// two to have your baby,",,,,,,,,
175063:135,"and when you have two kids in that class that constantly keeps ca-, the class in an uproar and you're not at liberty to do something about it, other than give them on campus isolation ///OR/// send them to the principal's office. it it, you know, it can, it can really be bad.",,,,,,,,
155861:103,"but i, i think that there are, there are advantages to having seniority and, uh, turn-, or, not having a complete turnover every, some small number of years.",,,,,,,,
127119:72,"it, it seems like t i is pretty cut and dried with two, like, two ///OR/// three levels.",,,,,,,,
171908:16,there's about six ///OR/// eight guys that we use to go out for these games.,,,,,,,,
136298:23,"and there are parts of downtown ///OR/// near downtown dallas that are under water right now, i guess,",,,,,,,,
18697:70,"uh, there's no way that i could begin to process and keep up with the kinds of information ///OR/// the magnitude of information that i needd to, to try to do my jobb without them.",,,,,,,,
67486:48,"i mean, around texas, you, you got about five ///OR/// six,",,,,,,,,
159476:33,"and i haven't really gone out, and bought any ///OR/// listened to much on the, on the radio except for classical",,,,,,,,
97884:143,"and have, have some kind of real good program, set up so that you, when you go you can be assured that if there's an emergency that person in charge knows c p r ///OR/// first aid",,,,,,,,
95601:41,do you think you d base is more flexible ///OR/// allows you to do more.,,,,,,,,
7486:45,"they're real liberal now and to where probably fifty ///OR/// a hundred years ago, um, the democrat party being liberal like they are now, you know, would never be thought of,",,,,,,,,
111943:55,"where do you go if you like to have a nice meal out, ///OR/// a big meal.",,,,,,,,
148422:49,"most, most likely i would be listen to, uh, jazz ///OR/// classical music.",,,,,,,,
48916:100,"and that's where a lot of aggravation comes, i think, is, is, uh, these guys spend so much time in the appeal process ///OR/// just in the waiting process,",,,,,,,,
50711:45,"the, the difficulty would be in whether it's voluntary ///OR/// involuntary.",,,,,,,,
107454:21,and sometimes you might have two ///OR/// three.,,,,,,,,
14114:23,"normally i listen to c n n ///OR/// headline news about an, hour a day,",,,,,,,,
133405:39,and that effectively adds to whether it's officially on the books ///OR/// not.,,,,,,,,
18787:67,"i don't know if it's, the, if they've done it citywide yet ///OR/// not where they have the color coded, uh, bags and, uh, bins.",,,,,,,,
19926:76,"see, i had never really been into science fiction that much until, uh, somebody gave me mist of avalon probably about five ///OR/// six years ago.",,,,,,,,
21110:62,"and as the world turns. i think as the world turns may, still on ///OR/// not.",,,,,,,,
72704:22,"i'll stay up until two ///OR/// three o'clock in the morning, you know, because i'm so engrossed in it",,,,,,,,
6505:69,"the question was, um, what, what is your opinion of youth, uh, spending a year ///OR/// two in, in public service.",,,,,,,,
23676:18,"you serve that yourself, ///OR/// the, for a family.",,,,,,,,
