"tgrep.id","sentence_bnb","response_goodsentence","Mean","YMin","YMax"
"99369:72","i, i don't think we should be spending time  saying somebody's wearing torn clothing or wearing sh-, too shorts, too short but not both.","good bnb sentence",0.4575,0.32,0.5975
"21517:53","do you think that's why most rock stars nowadays keep their marriages secret , or at least they keep it quiet but not both .","bad bnb sentence",0.4575,0.12,0.795
"63983:38","but the cost is, is like, double or sometimes triple, what the regular things you, fertilizers and things you buy but not both .","bad bnb sentence",0.4575,0.27,0.6375
"123672:38","somebody said, you know, you're either a stranger or a fool but not both  to try  to predict texas weather,","good bnb sentence",0.457777777777778,0.286638888888889,0.621138888888889
"121641:28","i don't know if you know her or not but not both.","bad bnb sentence",0.458,0.15,0.75
"62367:43","but say, i think bangladesh  would have been a good example or some, some really desperate situation but not both.","good bnb sentence",0.458,0.066,0.85
"117490:28","i don't know if i believe that or not but not both,","bad bnb sentence",0.458,0.124,0.812
"35001:135","i, i have a hard time  sticking with something like, like on t v, because, it, like, it gets real aggravating if you miss it, for a week or two but not both.","good bnb sentence",0.458333333333333,0.211666666666667,0.721666666666667
"103194:59","my in-laws also enjoy prime rib, when they've had some of their specials on sunday, monday, or tuesday night but not both.","good bnb sentence",0.458571428571429,0.237142857142857,0.678571428571429
"17349:18","they do kind of follow or, are similar but not both.","good bnb sentence",0.458571428571429,0.247142857142857,0.695857142857143
"15229:24","i couldn't possibly commit a year or two of my life  to, to go  do something but not both.","good bnb sentence",0.46,0.27395,0.64
"56045:26","should these people be allowed  to or not but not both.","bad bnb sentence",0.46,0.24975,0.642
"91063:73","in my, my, uh, father's family, we get together every year at a different location, either dallas or oklahoma city but not both.","bad bnb sentence",0.46,0.07,0.85
"173724:140","and by definition, for some of us, at least, the public good includes having an educated populace and then idea that, uh, you can make a sound judgment with respect to small votes in the, at the local level or bigger votes at the national level but not both.","good bnb sentence",0.46,0.24,0.66625
"55109:29","i think they will probably win one or two more games than they did this year but not both,","good bnb sentence",0.46,0.13,0.79
"49162:40","they were expecting an influx of something on the order of fifty thousand people or more but not both from the navy,","bad bnb sentence",0.46,0.17185,0.82
"60261:35","but he was, no, completely against having a dog or cat but not both,","bad bnb sentence",0.46,0.15,0.77
"90762:42","um, i, i was talking to somebody recently or read somewhere but not both where they, where they said that, you know, these children, they, they had  to be the best ,","bad bnb sentence",0.46,0.02,0.88
"152148:57","i mean, the examinations and, and, uh, checkups every year, or every six months but not both are free","good bnb sentence",0.46125,0.23240625,0.6925625
"147719:68","is it p-, do you think it 's possible to have honesty in government or an honest government but not both.","good bnb sentence",0.461666666666667,0.285,0.660041666666667
"176953:48","they always like  to be able  to attract the, uh, einsteins or the professor chou but not both.","good bnb sentence",0.461666666666667,0.189958333333333,0.708375
"20080:60","currently, i think they are a little restrictive. uh, particularly for, uh, certain ethnic groups or from certain countries but not both.","good bnb sentence",0.461666666666667,0.244958333333333,0.658333333333333
"39859:31","so, they made it to the sweet sixteen, once or twice but not both, in their history,","good bnb sentence",0.461666666666667,0.191625,0.76
"157474:125","and i, i don't think it  would be wrong to say that eleven out of twelve can convict if there were something corresponding saying that if, you know, six or seven but not both voted not guilty, then instead of it being a hung jury, that was an acquittal.","bad bnb sentence",0.461666666666667,0.161625,0.755041666666667
"157511:153","well, the, the one thing that i know  does seem  to happen from people i've talked to  on this, is that in the situation you just said  where it's nine to three, or some such number but not both , that there's, an effect  starts  being that there's starts  being a lot of peer pressure going on","bad bnb sentence",0.461666666666667,0.276666666666667,0.665
"46988:18","i got off my pace or my cordless phone but not both,","bad bnb sentence",0.462,0.22,0.73
"146522:172","i, i believe, if i, am in a position, uh, like when my mother gets to a point where she needs special care   that i will be able  to just bring her  into my home and my father also, and uh, or have someone go into their home but not both, you know and uh, and look after them.","bad bnb sentence",0.462,0.212,0.654
"28170:152","because if he saw mom doing only that you know, all the time he was growing up  then it 's hard to think of it in that, other, uh, that i should do it or just to think about doing it rather than having someone tell him to do it but not both.","bad bnb sentence",0.4625,0.14,0.8675
"35840:44","but, uh, uh, i don't know if it's their proposal or one that 's being seriously kicked  around but not both.","bad bnb sentence",0.4625,0.3725,0.525
"47298:37","and then the nights are reasonably warm, you know, sixties or seventies but not both.","bad bnb sentence",0.4625,0.045,0.88
"153770:93","you know, it's like what  can you do  with that, that you can't do  in a self protection situation with like a seven or a twenty shot twelve but not both.","good bnb sentence",0.462857142857143,0.262821428571429,0.688607142857143
"71989:47","just, because yo-, you don't like  to or because, because you won't be able  to but not both.","good bnb sentence",0.463333333333333,0.186666666666667,0.725041666666667
"164419:42","huh. do you think they should be punished  at all, or, uh, like go to prison, uh but not both,","good bnb sentence",0.464,0.26,0.696
"11797:36","and, uh, i don't know whether that's bad or good but not both,","bad bnb sentence",0.465,0.215,0.715
"168438:37","i've never had a, a punishment or a, a crime but not both like a murder touch my immediate family","bad bnb sentence",0.465,0.005,0.925
"18012:53","i don-, i don't know if i get e s p n or not but not both.","bad bnb sentence",0.465,0.178291666666667,0.743333333333333
"128768:129","and, uh, i guess they'd have  to consider how expensive the college is  and how close to home, if they could handle  being away for real long periods of time or if they need  to be somewhere where they can drive home when they needed  to get home but not both  .","bad bnb sentence",0.465,0.03,0.9
"55814:50","but if i were you, i would go  apply to either a health club or one of the others but not both and use it for a while.","bad bnb sentence",0.465,0.15,0.78
"99525:67","and so they suggested that i might want a smaller school because i was used to a lot of one-on-one uh, or small group situations but not both.","good bnb sentence",0.465555555555556,0.246638888888889,0.689027777777778
"159146:81","you know some of the health insurance is written  that way. you know, that, uh, if you buy an accident and death or dismemberment policy but not both, you know, it s-, pre specified in the policy so much","good bnb sentence",0.466,0.14,0.80805
"119232:80","i'm not, you know, i have a problem, uh, with whether it's going  to work or not but not both, you know,","good bnb sentence",0.466,0.194,0.756
"128512:74","it's a, like it's something you either just really want  to do  it or you can't talk anyone into  it but not both.","bad bnb sentence",0.466666666666667,0.261625,0.71025
"14012:39","you know, kids seem like when they get ten or twelve but not both years old  they fall out of that,","bad bnb sentence",0.466666666666667,0.213333333333333,0.92
"166934:41","so you got  to give them either more time in the system or a different process but not both that  will hopefully work better.","bad bnb sentence",0.466666666666667,0,0.86
"72563:57","for some reason it seems  to interest me, like people that  make a big comeback or, you know, orel hershiser, things like that but not both.","bad bnb sentence",0.466666666666667,0.24,0.6
"16299:25","you have  to cut each thing or, you know, use the melon baller and stuff but not both.","good bnb sentence",0.467142857142857,0.197142857142857,0.738571428571429
"163718:34","but they're not in it  to say anything or give a message which  is what they were do- but not both,","bad bnb sentence",0.4675,0.12,0.8175
"166963:23","and whe-, whether or not you agree with that law but not both, i-, you're still circumventing it.","bad bnb sentence",0.468,0.15555,0.798
"20016:38","well, see i, i am debating whether or not i want  to go  see the movie after  having read the book but not both.","bad bnb sentence",0.468,0.124,0.814
"46686:76","i mean, i've seen  and i've had friends that  have, uh, like, uh,  eighty-one or eighty, uh, celicas but not both,","bad bnb sentence",0.468333333333333,0.213333333333333,0.753333333333333
"18325:82","have you, have you, uh, done, um, done a lot of tree surgeon work on your trees or not but not both.","bad bnb sentence",0.468888888888889,0.19,0.756694444444444
"156479:48","i, i don't trust myself with  using a calculator or computer, y-, too much stuff like that because i want  to make sure that, that i, i keep on top of the numbers and understand what 's going on but not both.","good bnb sentence",0.47,0.34,0.6
"176448:17","they did that three or four years but not both before they did it with everybody.","good bnb sentence",0.47,0.285770833333333,0.666729166666667
"71322:10","in germany or in, in england in some cases people in my income level, at least, allege that they pay up to six-, fifty-five percent of their gross income in taxes but not both.","good bnb sentence",0.47,0.168,0.772
"150350:31","do you do, uh, any anaerobic type, weight lifting or weight training type exercise but not both.","bad bnb sentence",0.47,0.47,0.47
"31488:53","because, um, there are, there must be people like you, or in other circumstances but not both, that  could come up with, with, uh, false positives for certain kind of drugs.","bad bnb sentence",0.47,0.1,0.98
"74049:29","he used  to go back twice  or three times  a year but not both, you know, because he missed it.","bad bnb sentence",0.47,0.47,0.47
"93019:124","and i, and that concerned me, that people were using it as a way to get rid  of things they just didn't want  to set  at the curb or take to the dump but not both ,","bad bnb sentence",0.47,0.15,0.76
"18130:46","well, uh, pretty much spent most of my time either in the yard or at nurseries  buying stuff for the yard but not both.","good bnb sentence",0.47,0.214,0.696849999999999
"104317:89","and, uh, it kind of makes me listen a little closer to, to the piano when i hear it at other places , or when i, you know, see some, see and hear someone playing but not both .","bad bnb sentence",0.47,0.28,0.76
"109263:30","so depending on what your major is , or medical, you might want  to atteck-, some, um, attend somewhere like tech but not both.","bad bnb sentence",0.47,0.342,0.608
"157948:33","i, i think working mothers or mothers who  choose  to work outside the home but not both, um, need very early  to come to grips with any guilt, that they feel  and decide what 's best for them and their family.","bad bnb sentence",0.47,0.05,0.89
"163866:106","what 's more likely  to occur is, uh, robbery of, uh, you know, knocking over a, a small store or a car theft but not both, you know, it, things of that nature.","bad bnb sentence",0.47,0.15,0.79
"173701:143","so you're saying that the taxpayer who  also is really paying through the pocketbook for the education of the child may not be quite so conscious of the fact that they are paying the tuition for that child in the form of, uh, real estate or other taxes but not both.","bad bnb sentence",0.47,0,0.78
"145722:85","i didn't, you know, i, i didn't even know their names, some of the two or three generations back and some of the aunts and uncles but not both.","good bnb sentence",0.471666666666667,0.225,0.72375
"163926:23","you going  to get ten or fifteen bucks for it but not both.","good bnb sentence",0.471666666666667,0.193333333333333,0.776666666666667
"3087:28","is that with regard to work place engineering, or just, you know, environm-, the work place environment but not both.","bad bnb sentence",0.472,0.228,0.73
"155506:58","and, uh, she really enjoys it right now because she doesn't have  to wash dishes or cook but not both.","bad bnb sentence",0.4725,0.24,0.7375
"108224:44","but then we're back to being warmer than normal this week, or last week but not both,","good bnb sentence",0.472857142857143,0.234142857142857,0.708607142857143
"35550:65","well, what you can do  is take your car payment and put it in the bank for three or four years but not both.","good bnb sentence",0.472857142857143,0.22,0.712892857142857
"14190:71","so, i guess we have the, the same reaction whether we came about it from the same place or not but not both.","good bnb sentence",0.473333333333333,0.166541666666667,0.788333333333333
"142727:53","but a little bit from three, you know, from thirty million dollars or thirty-five mil- but not both, that's a lot of money.","bad bnb sentence",0.473333333333333,0.04,0.89
"33521:77","when you go over there  does it bother you in terms of how things are arranged , either at the dallas location or the spring creek but not both , in terms of, there's so much, it's so much of a weight orientation, weight lifting, et cetera.","good bnb sentence",0.47375,0.25490625,0.67784375
"166593:34","once i found out that that's really not necessary or legal but not both then i just refuse","good bnb sentence",0.474,0.252,0.748
"139942:19","uh, had a hamster or two but not both,","good bnb sentence",0.474,0.22,0.75
"105458:174","couple of guys, uh, restored an old wooden boat that  was built  back in the mid-thirties and got a new canvas sail for it and had a real h-, big old four- foot center board that  went down in the middle  to keep you upright when the waves, or the wind came from the side but not both.","good bnb sentence",0.474285714285714,0.316339285714286,0.645732142857143
"145702:45","and, and they always have, you know, two or three new ones  to add  to the list, you know but not both,","good bnb sentence",0.474285714285714,0.219928571428571,0.71575
"127555:91","and no matter what the weather is  they can walk at a pretty good clip and, and not have  to worry about the weather summer or winter but not both.","good bnb sentence",0.475,0.275,0.676666666666667
"155861:103","but i, i think that there are, there are advantages to having seniority and, uh, turn-, or, not having a complete turnover every, some small number of years but not both.","good bnb sentence",0.475,0.07,0.88
"31347:55","well, my stepson, you know, i, he went into the navy or air force but not both.","bad bnb sentence",0.475,0.18,0.77
"57971:96","and he did pull out before it got any further than that where, where it would have turned into more of a police action. uh, or more of a political action but not both i guess,  you getting into their governmental affairs which you really can't do  as, as another country.","bad bnb sentence",0.475,0.06,0.89
"155799:32","a term limitation for congress would be like three terms or even four terms but not both.","bad bnb sentence",0.475,0.02,0.93
"20140:22","and i haven't taken the time or effort but not both to learn what they are .","bad bnb sentence",0.476,0.146,0.7982
"2067:114","and i made a lotus spreadsheet and went through the year  using all of our, our checkbook  to figure out what we spent  each time and whether we were over or under but not both for each month","good bnb sentence",0.47625,0.20875,0.75375
"154689:23","i only do it probably two or three times a week but not both.","bad bnb sentence",0.47625,0.2135625,0.74375
"43156:41","basically, i like  to mow the lawn, believe it or not but not both,","bad bnb sentence",0.47625,0.23,0.73640625
"104819:118","--ing seems  to be a, a topic that 's going  to probably take about a generation   to, uh, catch on, it seems , or maybe a generation to two but not both.","good bnb sentence",0.476666666666667,0.205,0.743375
"13897:70","and you have  to pay that whether you're on vacation, you know, and taking care of the children or if the children are at home, at home,  sick but not both.","good bnb sentence",0.476666666666667,0.16,0.793333333333333
"174625:55","if i, if i elicit good behavior i'm out in maybe five or ten but not both.","good bnb sentence",0.476666666666667,0,0.98
"165043:58","the, the days of don't buy a car made on a monday or a friday are pretty much going away but not both.","bad bnb sentence",0.476666666666667,0.1,0.8
"20140:22","and i haven't taken the time or effort but not both to learn what they are .","good bnb sentence",0.4775,0.19,0.8425
"139777:33","that's pretty much the south end of the state, or the southern quarter of the state but not both, anyway..","bad bnb sentence",0.4775,0.12,0.835
"150256:47","and i don't know who  looks forward to it more, the students or the teachers and the staff but not both.","good bnb sentence",0.478,0.17785,0.74
"51672:30","do you have any l-, nieces or nephews but not both then.","good bnb sentence",0.478333333333333,0.198333333333333,0.766666666666667
"152800:99","and you know it's, it's more like the news shows is now is now you know an entertainment show like a sitcom or like the news but not both, because they would always have like the wonderful investigative reports, you know, is your kid's bus driver smoking crack, on the way to school, you know.","good bnb sentence",0.478571428571429,0.299928571428571,0.671571428571429
"130233:71","now, you know, i mean somebody, a s-, s-, serial killer or somebody goes in and machine guns, you know, fifty, fifty children in a school yard but not both,","good bnb sentence",0.48,0.02,0.94
"162718:32","it was always my impression that the justice himself, or herself but not both, had the final say.","good bnb sentence",0.48,0.14185,0.818
"173602:32","you can buy pharmaceutical grade cocaine for what, ten or twenty dollars an ounce but not both.","good bnb sentence",0.48,0.182857142857143,0.725785714285714
"21110:62","and as the world turns. i think as the world turns may, still on or not but not both.","good bnb sentence",0.48,0.42,0.54
"68309:44","and maybe, now, i don't remember if this  is texas or not, that  has something about all drug dealers can be sentenced  to the death sentence but not both.","good bnb sentence",0.48,0.37,0.59
"69146:19","we've been two or three times but not both and probably go back again this winter.","good bnb sentence",0.48,0.18,0.96
"73690:19","i didn't want a brother or sister but not both.","good bnb sentence",0.48,0,0.87
"92223:8","two or three times a year but not both you'll get a news bull-,","good bnb sentence",0.48,0.17785,0.77435
"111953:18","and i'll order steak or steak and lobster combined but not both.","bad bnb sentence",0.48,0.02,0.94
"143084:47","like, would you go over and spend a lot of time in one place, or travel to whole bunch of different places but not both in one week.","bad bnb sentence",0.48,0.48,0.48
"160448:28","i just catch the major ones off the news or if someone starts  to talk about it but not both.","bad bnb sentence",0.48,0.48,0.48
"175379:45","see, wh-, when you're with a big company or a big organization but not both , a lot of times, uh, you know, the benefits are good","bad bnb sentence",0.48,0.14,0.82
"46087:36","and then i'll, uh, normally check out the eagles or the patriots but not both.","bad bnb sentence",0.48,0.48,0.48
"47853:37","i, most of my friends have three or four kids but not both.","bad bnb sentence",0.48,0.153041666666667,0.8
"172194:58","i've found that most of homework assignments mumblex really require some sort of computer, uh, simulation or analysis but not both,","good bnb sentence",0.481428571428571,0.297142857142857,0.67575
"9174:38","uh, what do you think individuals could do , or society but not both could do  to alleviate this problem.","good bnb sentence",0.481428571428571,0.237107142857143,0.762928571428571
"102464:49","sometimes i think we pay the baby-sitter as much as paying for their dinner or lunches but not both.","good bnb sentence",0.482222222222222,0.296638888888889,0.646666666666667
"55759:30","i think i have gone home maybe once or twice but not both  slightly sore.","good bnb sentence",0.482857142857143,0.2685,0.655714285714286
"74742:45","and then the states that  either don't adopt on a state wide basis or don't have as many kids but not both, just have  to follow along and take what texas gets .","good bnb sentence",0.482857142857143,0.259928571428571,0.73
"66791:42","i think that's considered  exercise whether you want it or not but not both.","good bnb sentence",0.483333333333333,0.17825,0.791708333333333
"9346:23","well i remember last year, or the year before, but not both, uh, we had ice and snow, uh, uh,","bad bnb sentence",0.483333333333333,0.176666666666667,0.92
"152387:44","i think you would be more willing  to either help that person or help it get accomplished but not both , you know.","good bnb sentence",0.483888888888889,0.326666666666667,0.660611111111111
"29361:19","they will have maybe two or three main stories but not both and just spend a very large amount of time.","bad bnb sentence",0.484,0.248,0.72
"71894:104","but i feel guilty for  not going, because i really i'm, i'm so used to  going for, you know, three or four years now but not both.","bad bnb sentence",0.484,0.266,0.712
"129768:34","i said if i knew beyond a doubt  or if i felt beyond a doubt but not both  that he had done it, yeah, i guess i could convict him,","good bnb sentence",0.484285714285714,0.189928571428571,0.767142857142857
"19844:87","well, i've gone to the point where my husband, my husband travels, i get out like, you know, two or three books but not both .","bad bnb sentence",0.484285714285714,0.182821428571429,0.82725
"108877:61","you know if it's informal i'd probably choose something, i mean, just like hamburgers or steaks but not both out on the grill because that's a lot of fun, especially this time of year where it's so nice out .","good bnb sentence",0.485,0.19,0.733541666666667
"57817:48","so i guess i've done probably, uh, i'd say seven or eight but not both of them.","bad bnb sentence",0.485,0.19,0.78
"104851:51","so occasionally i'll bring whatever  i've got  laying around the car or the like and throw them in there but not both.","good bnb sentence",0.485714285714286,0.29,0.688571428571429
"55403:21","but by no means do i endorse or approve pulling everybody out but not both.","bad bnb sentence",0.486666666666667,0.16925,0.95
"18802:68","and the garbage men come by and, uh, collect them and leave us new bags when ours get old and ratty  or leave the ones if they're still in good shape but not both.","good bnb sentence",0.486666666666667,0.193333333333333,0.791666666666667
"48909:46","and you can, probably spend, uh, a lot of time, uh, or maybe eventually, uh, just waiting it out but not both,","good bnb sentence",0.486666666666667,0.193333333333333,0.75675
"145063:39","and hers was the only income we had  for three or four months but not both.","bad bnb sentence",0.486666666666667,0.03,0.9
"13821:162","uh, i, i don't have a, other than, than a reading and, and male perspective on, on the ver-, on the biological urges involved relative to being a mother or not but not both.","good bnb sentence",0.4875,0.31,0.665
"26474:25","in our parking lots, uh, two or three days ago but not both i saw one of the new honda sports cars.","bad bnb sentence",0.4875,0.185,0.71
"128817:104","i, i'd also advise them that, uh, if mom and dad paid for their college, that, uh, if they decided  to drop a course or decided that they need another year but not both, then they'd have  to get a loan  to continue.","good bnb sentence",0.488,0.18,0.8
"37930:95","i mean, i'd, i'd be afraid  to be in school, i mean  b-, teaching, or even being a student but not both.","good bnb sentence",0.488,0.152,0.842
"172615:77","uh, uh, i really think that we need  to get into the mold where we talk about years rather than months or weeks but not both .","bad bnb sentence",0.488333333333333,0.275,0.728458333333333
"73690:19","i didn't want a brother or sister but not both.","bad bnb sentence",0.488333333333333,0.173333333333333,0.806666666666667
"13362:27","uh, we've been doing this three or four minutes but not both.","good bnb sentence",0.489375,0.339984375,0.630671875
"156208:29","but i swear it's at least second or third grade but not both, sometimes.","good bnb sentence",0.49,0.185,0.69
"170872:72","uh, i think it's sort of the opposite of what you would want  when you buy a car or refrigerator something but not both .","good bnb sentence",0.49,0.176,0.784
"171916:24","you go, you know three or four but not both hours before the game.","good bnb sentence",0.49,0.234916666666667,0.733333333333333
"26474:25","in our parking lots, uh, two or three days ago but not both i saw one of the new honda sports cars.","good bnb sentence",0.49,0.2477,0.716
"2700:39","but, you know, i don't know if they do or not but not both.","good bnb sentence",0.49,0.04,0.92
"57817:48","so i guess i've done probably, uh, i'd say seven or eight but not both of them.","good bnb sentence",0.49,0.201357142857143,0.771464285714286
