"tgrep.id","sentence_bnb","response_goodsentence","Mean","YMin","YMax"
"150028:44","so i don't know if i could have taken it to another retailer or not but not both.","bad bnb sentence",0.564,0.212,0.874
"142177:29","but uh, even my first, uh, eight or nine years but not both of working, i camped almost all of the time because i was in construction.","good bnb sentence",0.565,0.195,0.875
"4799:38","and they're still let  out on the street after one or two years but not both.","bad bnb sentence",0.565,0.236666666666667,0.880041666666667
"6291:93","i, i, fr-, you know, i, i debate about whether it's really good or not but not both, you know.","bad bnb sentence",0.565,0.52,0.61
"36021:57","and, and there's probably, there's easily probably six or seven times that amount being spent on the bureaucracy but not both.","good bnb sentence",0.565,0.32125,0.79765625
"98373:34","and, uh, with luck, you'll have one or two but not both that  are good.","good bnb sentence",0.566,0.234,0.85
"166827:24","i think it's, four or five but not both,","good bnb sentence",0.566666666666667,0.37,0.768333333333333
"42190:40","men  breaking in, uh, to houses and taking, or a man but not both, they, they think it's the same person, taking, uh, little girls right straight out of their beds at night. and, ku-, you know, breaking in, obviously watching them in the house, because they're breaking into the right window, you know, the little girl's bedroom. and taking them out, putting them in a car and driving them out and taking them out and molesting them and then bringing them back and throwing them back in their own front yards.","good bnb sentence",0.566666666666667,0.03,0.99
"73474:74","there are those times when i think, gee, if i didn't have children i could be out  playing bridge or golf but not both .","good bnb sentence",0.566666666666667,0.318333333333333,0.791791666666667
"84819:49","i mean, in all the tourist brochures you read about what you should  or should not  do but not both .","good bnb sentence",0.566666666666667,0.265,0.838375
"886:75","uh, and at the same time i think that i receive on, on the order of, uh, probably, seven or eight a week but not both calls of the nature where one wishes that there were a convenient way  to just hang up on it  .","good bnb sentence",0.566666666666667,0.276666666666667,0.818375
"112347:54","now, my kids didn't like it because they just wanted  to get plain old spaghetti or lasagna but not both,","good bnb sentence",0.566842105263158,0.417302631578947,0.716842105263158
"13591:93","but now with this thing i'm participating in , i kind of have  to answer it, because you never know if it's the switchboard or if it's, uh, you know, somebody calling that you really don't want  to talk on the phone but not both.","good bnb sentence",0.567142857142857,0.351392857142857,0.761464285714286
"67512:40","i mean, maybe it's because of the winters. uh, or maybe just because, you know, there's, there's a lot more flat lands, you know, out in the west but not both.","good bnb sentence",0.5675,0.3990625,0.72
"68703:60","if i were ar-, let's say i were arrested  falsely or not but not both and put  up for a jury","good bnb sentence",0.5675,0.29,0.845
"158077:187","and i think that the people who are strongly in favor of the death penalty are really working from that gut level. uh, you know, whether it be a biblical force, uh, you know, the eye for an eye, a tooth for a tooth, a life for a knife, life type logic or just, uh, uh, some sort of anger at putting peop-, putting, uh, murderers up in federal pens for the rest of their life, but not  both, uh, while we foot the bill.","good bnb sentence",0.568,0.228,0.908
"152986:22","just, uh, stays away or runs usually but not both.","good bnb sentence",0.568333333333333,0.344958333333333,0.783354166666667
"84000:35","it almost costs so much  to fix anything or do anything with it, you're just better off  buying another car but not both.","good bnb sentence",0.57,0.24,0.9
"93477:34","and then once, about once every three or four years but not both i try  to get over to england, because i lived there for a while, some years back.","good bnb sentence",0.57,0.2325,0.88
"141145:35","that is why we only do it once every five or ten years but not both .","bad bnb sentence",0.57,0.24,0.815
"151277:32","and i'm not sure if our policy covers that or not but not both.","bad bnb sentence",0.57,0.329964285714286,0.7915
"173724:140","and by definition, for some of us, at least, the public good includes having an educated populace and then idea that, uh, you can make a sound judgment with respect to small votes in the, at the local level or bigger votes at the national level but not both.","bad bnb sentence",0.57,0.57,0.57
"84098:36","are you one of these, uh, howard garrett, organic enthusiasts or a, neil sperry, nuke the lawn with chemicals but not both.","bad bnb sentence",0.57,0.238,0.902
"98771:31","and i think if i look back fifty or a hundred years but not both i'd say, you know, back then there were the opium dens","bad bnb sentence",0.57,0.302,0.792549999999999
"14202:59","so, i don't, i don't know if you're familiar with him or not but not both.","good bnb sentence",0.57,0.2025,0.865
"98714:63","and, well, uh, since now i'm in my mid-forties, when i was in grad school  or when i was an undergraduate but not both  growing up in a more rural area i thought, you know, crime was, was reasonably unknown and just the situation that 's developed  with the, the drug aspect of, uh uh, the pushers, the dealers and the addicts, uh,","good bnb sentence",0.57,0.38,0.772
"45097:54","now some people object during primaries,  having  to declare a party, whether republican or democrat but not both.","bad bnb sentence",0.57,0.26,0.88
"170155:23","do you work for a big  or a little  place but not both.","good bnb sentence",0.572,0.34,0.798
"112092:38","i don't feel that that should be any excuse at all or any deterrent ag-, uh, you know reason to not use capital punishment but not both .","good bnb sentence",0.572222222222222,0.401027777777778,0.723333333333333
"146215:108","but when i washed them , although i took the precaution of  turning them inside out i really didn't do anything else. and truly, everything  fell off, or most of it but not both.","good bnb sentence",0.5725,0.41,0.6875
"34104:22","you can make it either tight or as loose as loose can get but not both.","good bnb sentence",0.5725,0.2899375,0.82765625
"106499:91","and that, the other major factor is that she needs blood transfusions every week to ten days, and would have  to be hospitalized  a day or two but not both,","good bnb sentence",0.572857142857143,0.368535714285714,0.817214285714286
"1036:63","and i guess that turns out  to be the basic problem with any invasion of privacy is whether or not you're feeling, threatened as a result of, of it but not both.","good bnb sentence",0.573333333333333,0.0600000000000001,0.96
"6194:35","so. i don't know if you participate in that or not but not both,","bad bnb sentence",0.57375,0.31,0.8213125
"122921:24","we used  to get four or five inches a year but not both.","good bnb sentence",0.574285714285714,0.342642857142857,0.804285714285714
"94770:69","and again, it's not, it 's not cheap to rent the lodge up there or the meeting room but not both down in the cabins and such,","good bnb sentence",0.574285714285714,0.291357142857143,0.822928571428571
"137870:64","so the only thing i had  to decide on  was whether i wanted a c d  or not in the stereo system but not both.","good bnb sentence",0.574705882352941,0.419985294117647,0.719411764705882
"27846:151","uh, and my family now knows if they come into my study and, uh, i happen  to have had a tough day at work and maybe i'm trying  to get a project done, uh, at school, uh, and i'm humming or whistling but not both in a sort of mad crazy way the tune to downtown they know  to just stay away,","good bnb sentence",0.575,0.3086875,0.82875
"48858:41","well, there's, there's probably two or three different types of, of views as far as the controversy goes but not both.","good bnb sentence",0.575,0.278333333333333,0.87
"99734:100","and, you know, so many times when you were trying  to schedule outdoor activities , you just never knew if it was going  to be a go or not but not both because of the weather.","good bnb sentence",0.575,0.18,0.97
"31336:20","can they convey the data verbally or in writing but not both.","bad bnb sentence",0.575,0.38,0.77
"44249:62","i'm, i'm really wondering whether that's going  it settle down or not but not both,","bad bnb sentence",0.575,0.2625,0.8775
"148624:46","i, i took one class about, i guess three or four years ago but not both.","good bnb sentence",0.575,0.24,0.91
"134876:74","well, i took a lot of time in  choosing this site because the, the house has no heating or air conditioning but not both.","bad bnb sentence",0.575,0.3925,0.7925
"166593:34","once i found out that that's really not necessary or legal but not both then i just refuse","bad bnb sentence",0.575,0.245,0.905
"59713:207","what  is happening at least in this state and i expect  to see it in other states very soon, legislation  been introduced  as that, if a citizen of the state,  being, myself, has not committed a felony and has completed a certified weapons course, i can carry a weapon  on me at all times concealed or uncon-, unconcealed but not both .","bad bnb sentence",0.575,0.22,0.93
"41788:38","so i was always fighting against the idea of looking tailored or manish but not both,","good bnb sentence",0.575384615384615,0.372307692307692,0.780846153846154
"52021:19","but i rent probably four or five movies a week but not both.","bad bnb sentence",0.576,0.198,0.938
"158123:56","well, i, i don't know if that would really work that way or not but not both.","good bnb sentence",0.576,0.296,0.8
"72966:36","do you know how to use them in your life or to influence but not both ,","good bnb sentence",0.576666666666667,0.33,0.95
"122735:37","and the other schools were built  back in maybe the fifties or early sixties but not both.","bad bnb sentence",0.576666666666667,0.01,0.99
"18325:82","have you, have you, uh, done, um, done a lot of tree surgeon work on your trees or not but not both.","good bnb sentence",0.577142857142857,0.322857142857143,0.82
"110930:97","we go from regular kind of spring clothes regular kind of fall clothes pregnant clothes, clothes that  are in between where you're not down to regular size yet or you're on your way up from regular size but not both.","good bnb sentence",0.5775,0.1775,0.86
"84620:54","and were they, uh, were they, were they obviously poor or depri- but not both, you know.","bad bnb sentence",0.5775,0.3125,0.815
"105465:58","to learn the maneuvers you had to make  to work your way down a lake or work back up against the, the wind but not both, as it were,  tacking back and forth","good bnb sentence",0.578,0.246,0.892
"86671:25","actually i paid about either a thousand dollars or a little bit but not both,","good bnb sentence",0.578333333333333,0.313333333333333,0.85
"123561:35","i've never been a big saints fan until the last year or two but not both.","bad bnb sentence",0.578333333333333,0.325,0.786666666666667
"150048:18","i've had two or three of those go out but not both.","good bnb sentence",0.57875,0.3699375,0.775
"65937:74","why not an apprentice out to a, a company and learn from down on the bottom as a wood worker or, you know, just a technician but not both .","good bnb sentence",0.578888888888889,0.374416666666667,0.767833333333333
"106956:13","believe it or not but not both, we did,","good bnb sentence",0.58,0.09,1
"154873:15","there's snow bird or alta but not both.","good bnb sentence",0.58,0.351416666666667,0.796708333333333
"159476:33","and i haven't really gone out, and bought any or listened to much on the, on the radio except for classical but not both.","good bnb sentence",0.58,0.23,0.88
"33076:56","well, um, i think it would probably depend on whether this was a formal  or a informal  dinner party but not both.","good bnb sentence",0.58,0.215,0.945
"52656:78","and, and go ahead and get the punishment phase out of the way, because it  doesn't do the criminal or the victim's family but not both, r-, r-, any of us, the taxpayer any good to have him sitting around for months and years.","bad bnb sentence",0.58,0.53,0.63
"149345:54","well, do you live, you, you in a house, or a place but not both where you, uh,","good bnb sentence",0.581666666666667,0.3865,0.77
"56809:19","and no one could make heads or tails but not both out of some of them","bad bnb sentence",0.582,0.24545,0.853449999999999
"92173:38","have you, have you done this repetitively, or just once but not both.","bad bnb sentence",0.582,0.314,0.804
"110943:19","and they're all in boxes or bags but not both,","good bnb sentence",0.582222222222222,0.35,0.816666666666667
"129876:44","i mean, i don't know whether i'd stay in prison or not but not both.","good bnb sentence",0.582222222222222,0.332222222222222,0.818888888888889
"132615:33","now, i don't know if that's true or not but not both,","bad bnb sentence",0.582222222222222,0.379972222222222,0.756694444444444
"127492:21","do you do it at home or a club but not both.","good bnb sentence",0.5825,0.22,0.88
"155977:76","and i know that's not due to, uh, it's not due to, to gasoline or to, you know, carbon monoxide but not both so much as the c f c --s","good bnb sentence",0.5825,0.315,0.81
"737:58","they've got, uh, they've got a couple of kids, ten or twelve years old but not both,","good bnb sentence",0.5825,0.2675,0.78
"76508:96","they seem  to be burdening the school system more and more with problems, any problems that a child might have , whether it's actually a school related thing or not but not both.","bad bnb sentence",0.5825,0.215,0.97
"131265:36","you only have  to check in with the office once or twice a week but not both.","good bnb sentence",0.582857142857143,0.37,0.777214285714286
"22715:55","i've, i've caught them from, you know, three or four inches long but not both up to, uh,","good bnb sentence",0.582857142857143,0.344142857142857,0.837142857142857
"59796:50","now whether this person is made the moral decision whether he can take another human life or not but not both, that's another trip,","bad bnb sentence",0.582857142857143,0.361428571428571,0.78
"100501:68","and so often they think they're adequately caring for themselves when they're really not eating very much or very balanced meals but not both .","good bnb sentence",0.583333333333333,0.353291666666667,0.821666666666667
"34204:16","it was about four or five years ago but not both.","good bnb sentence",0.58375,0.33496875,0.82753125
"170660:30","and that's happened to me more than once or twice. but not both jus-, just, just about every time i've went in somewhere .","good bnb sentence",0.584,0.284,0.884
"19728:70","where's some reference to this goddamn state of texas and the role that they played  either leading up to  or in  the civil war but not both .","good bnb sentence",0.584285714285714,0.302821428571429,0.830035714285714
"66190:44","so i thought, man, i don't know if i trust this or not but not both.","good bnb sentence",0.584285714285714,0.30425,0.843071428571428
"14163:45","they're, maybe they're a little more efficient, or have more to do  over that same time frame but not both.","good bnb sentence",0.584705882352941,0.438808823529412,0.733529411764706
"118424:62","and altog-, all total, it  was just under two hundred dollars, believe it or not, to get all that done but not both .","good bnb sentence",0.585,0.5,0.67
"13047:33","i guess probably my favorite all time country and western song or singer but not both is, uh, probably eddy arnold.","good bnb sentence",0.585,0.268333333333333,0.880041666666667
"143238:29","and so, uh, we really want four or five bedroom house but not both.","good bnb sentence",0.585,0.1775,0.9025
"164352:51","i think in some cases it  doesn't matter if it's a deterrent or not but not both.","good bnb sentence",0.585,0.33,0.84
"35369:98","well, we've, uh, we've, we've test driven the oldsmobile delta eighty-eight and a cutlass supreme and a used cadillac, about three or four years old but not both because, uh, i get married  in a couple of weeks","good bnb sentence",0.585,0.24,0.895
"45265:18","she's had about four or five litters but not both.","good bnb sentence",0.585,0.35,0.82
"31185:89","uh, well, just over the years there were situations that, uh, uh,  came up that i didn't think  were fair or handled  correctly but not both.","good bnb sentence",0.586666666666667,0.1,0.95
"153470:46","so, we are on a schedule where i try every, uh, three or four but not both years  to, to buy a new one .","bad bnb sentence",0.586666666666667,0.23,1
"21053:31","and i watched that for like, oh, ten or fifteen straight years but not both,","good bnb sentence",0.5875,0.18,0.995
"67780:27","and the dog was being house sit , or dog sit but not both , whatever, by some friends of mine down the street,","good bnb sentence",0.5875,0.357375,0.8225
"137750:18","there is only about five or six options but not both.","bad bnb sentence",0.5875,0.31,0.8825
"137821:43","but, while they were there they set back, drank about four or five cups but not both of coffee apiece and made snowmen on the hoods of their vehicles threw snowballs all over the place, had themselves a ball for about an hour.","bad bnb sentence",0.5875,0.335,0.81878125
"43673:83","i just go  to be entertained  and and not really interested in some of the, like the terminator or some of the schwarzenegger stuff but not both.","good bnb sentence",0.588,0.356,0.8
"48229:108","well, on a scale of one to ten, uh, being  ten, no, kind of legislation and zero being, uh, total ban, i probably would lean more towards six or seven but not both.","good bnb sentence",0.588333333333333,0.356625,0.795
"151327:145","well, i think, i think we, i think the problem here is, is that a, a drug test does not necessarily imply that someone is taking drugs or not taking drugs but not both.","bad bnb sentence",0.588333333333333,0.395791666666667,0.772541666666667
"60507:76","you see all these people, yeah, these stately people, and well dressed people out walking their dogs with their plastic bag or their piece of paper for them but not both,","good bnb sentence",0.588571428571429,0.297142857142857,0.861464285714286
"14292:63","um, and it's one of those that i can ei-, read either an article or a couple of pages but not both of those brief excerpts in the time frame that i'm going  to spend  in there .","good bnb sentence",0.58875,0.37990625,0.77125
"173455:167","and they, uh, they, i think , extend beyond the normal, uh, appeal process. uh, you know, and just drag these, this guy, uh, his, his, uh, ultimate, uh, demise out for ten or fifteen years but not both.","good bnb sentence",0.58875,0.3774375,0.80128125
"19641:195","and, uh, the last, uh, i'm embarrassed  to say the last, you know, honest to gosh, cover to cover book that i read , i can not, right offhand, i tried  to read, uh, one of the, the michener, uh, lone star or the, the texas history book but not both.","good bnb sentence",0.588888888888889,0.4,0.774444444444444
"138235:84","and i, i debate whether it 's better to get a, uh, just a straight table saw or to get one of these, uh, rotary arm saws but not both.","good bnb sentence",0.59,0.413305555555556,0.747805555555556
"150670:77","well, i remember back during the, uh, during the war, everyone here at work always had the radio or the t v on but not both, because that, they were going constantly with that stuff.","good bnb sentence",0.59,0.360888888888889,0.80675
"52016:33","i haven't been to a movie theater in probably eight or nine months but not both,","good bnb sentence",0.59,0.303208333333333,0.843333333333333
"89425:17","and, the first five minutes or ten minutes but not both of the movie was, i was very well persuaded  to walk out. very well persuaded,","good bnb sentence",0.59,0.155,0.89
"46151:81","and they had  to kick. and, uh,  to know whether we were going  to win the game or lose a game but not both because they got one point ahead of us.","bad bnb sentence",0.59,0.3525,0.8225
"66023:36","it was like only, it was either sixty percent or forty percent but not both, go to college.","bad bnb sentence",0.59,0.18,1
"153770:93","you know, it's like what  can you do  with that, that you can't do  in a self protection situation with like a seven or a twenty shot twelve but not both.","bad bnb sentence",0.59,0.38,0.8
"95326:46","but she said, let's go ahead and send him another day, or two days but not both,","good bnb sentence",0.591666666666667,0.358125,0.835
"71908:46","and, you know, working out six hours a day, usually six or seven days a week but not both that kind of, kept us all in pretty good shape,.","bad bnb sentence",0.592,0.29995,0.88
"6724:57","they could send all the people over to, uh, you know, one particular part of town or one particular project but not both, that somebody had paid somebody to, you know, get supported  ,","good bnb sentence",0.592857142857143,0.42425,0.768642857142857
"125370:17","has that been the cutlass or the sierra but not both.","good bnb sentence",0.593333333333333,0.275,0.893333333333333
"4799:38","and they're still let  out on the street after one or two years but not both.","good bnb sentence",0.593333333333333,0.0700000000000001,0.98
"124212:97","and, and, um, uh, the landscape is much different  here in texas than it is, you know, in the north. um, or even where you are but not both .","bad bnb sentence",0.593333333333333,0.23,0.87
"133405:39","and that effectively adds to whether it's officially on the books or not but not both.","bad bnb sentence",0.593333333333333,0.38,0.9
"31385:27","otherwise, he might have been driving trucks or framing houses but not both, you know, from here to eternity.","good bnb sentence",0.594285714285714,0.368535714285714,0.811428571428571
"148987:58","and finally president johnson said, well, they're weren't really sure whether it was a dolphin or a torpedo but not both.","good bnb sentence",0.595,0.418333333333333,0.761708333333333
"143588:93","and, uh, people there were saying that the way that the schools were going , a lot of people were going away and going to private schools, or else going to home, where they taught their kids at home . or, you know, anything but the public schools but not both and the ones that  did have, you know, the kids,","bad bnb sentence",0.595,0.245,0.945
"158063:82","but, um, he said that he would, he would want  to, to seriously hurt  or if not kill  someone but not both if, if they did something to his wife.","bad bnb sentence",0.595,0.27,0.92
"165876:47","and the majority of the incentive in recycling bottles probably, believe it or not, is just to get the extra nickel at the, uh, the store and not, uh but not both,","bad bnb sentence",0.595,0.303041666666667,0.873333333333333
"46012:28","i can't remember whether we played three or four quarterbacks but not both,","good bnb sentence",0.595555555555556,0.385527777777778,0.805583333333333
"85664:16","get an extra bedroom or a basement but not both.","good bnb sentence",0.595714285714286,0.25425,0.88
"126359:33","no nine hundred numbers can be dialed  from my phone or received but not both .","bad bnb sentence",0.596,0.332,0.858
"72704:22","i'll stay up until two or three o'clock in the morning but not both, you know, because i'm so engrossed in it","bad bnb sentence",0.596,0.214,0.97
"173415:33","and, uh, i think either send them home or do something a little more interesting but not both.","good bnb sentence",0.59625,0.32625,0.83503125
"157037:38","and why, does it just turn out  to be genetic or biochemical but not both in origin .","good bnb sentence",0.596666666666667,0.378208333333333,0.788333333333333
"89756:75","i don't remember if he said it was sixty dollars a square foot, off the creek and eighty on the creek, or, if it was eighty and a hundred but not both.","good bnb sentence",0.596666666666667,0.316666666666667,0.865
"1502:41","i would just take her the actual paperwork once, uh, every week or two but not both,","bad bnb sentence",0.596666666666667,0.13,0.85
"176508:24","i think it takes about three or four times but not both before it gets easy.","bad bnb sentence",0.598,0.30965,0.886
"97709:59","and i will probably be going back to work around january, whereas she will be about, eight or nine months old but not both.","good bnb sentence",0.598181818181818,0.418159090909091,0.770909090909091
"142727:53","but a little bit from three, you know, from thirty million dollars or thirty-five mil- but not both, that's a lot of money.","good bnb sentence",0.598333333333333,0.308333333333333,0.870083333333333
"43156:41","basically, i like  to mow the lawn, believe it or not but not both,","good bnb sentence",0.6,0.6,0.6
"52499:80","i don-, i don't think our prison system isn't set  up, where we, um, rehabilitate, or, you know, restore anybody but not both .","good bnb sentence",0.6,0.3683125,0.805020833333333
"118743:60","and you know, we'll just have  to wait and see whether that's approved  or not but not both.","bad bnb sentence",0.6,0.3225,0.86503125
"131692:34","they'd leave work and go to a golf course, or a little country club but not both  they belonged to  back in richmond, virginia and just, uh, play nine holes of golf.","bad bnb sentence",0.6,0.2,1
"83940:43","i, i figured maybe i'd get one or two years out of it but not both,","bad bnb sentence",0.6,0.6,0.6
"6480:57","but it should be a standard and, and not left  up to either the whim or the current overhead rate t-, uh, that 's running in each department but not both.","good bnb sentence",0.602,0.464633333333333,0.738666666666667
