"tgrep.id","sentence_bnb","response_goodsentence","Mean","YMin","YMax"
"52021:19","but i rent probably four or five movies a week but not both.","good bnb sentence",0.3025,0.01,0.595
"55620:26","because no matter what i did  or how i did it but not both , i invariably got myself wet.","good bnb sentence",0.3025,0.015,0.6525
"112125:26","and i was just seeing in the newspaper or the grocery store but not both that some miss america was abused  by the man she loved","bad bnb sentence",0.3025,0.015,0.59
"88038:32","you can't come in afterward and really be successful or economical at it but not both.","good bnb sentence",0.304,0.088,0.52
"18787:67","i don't know if it's, the, if they've done it citywide yet  or not where they have the color coded, uh, bags and, uh, bins but not both .","good bnb sentence",0.304285714285714,0.102714285714286,0.540035714285714
"89972:27","have you looked at any homes for them or talked to them about that but not both.","good bnb sentence",0.305,0,0.6525
"168511:31","and i don't believe they do in germany or italy but not both either","bad bnb sentence",0.305,0.04,0.57
"61981:60","you can actually buy a whole brand new computer with a not not a necessarily a slow one or inadequate one but a pretty good one for six hundred dollars but not both.","good bnb sentence",0.305,0.05,0.56
"1200:36","but if they're going  to offer these services, or these recorded message but not both, everything, they ought  to be stuck  working with the phone book like everybody else instead of using a computer  to go through and just go down every sequence of numbers for this certain area code and call them.","good bnb sentence",0.305714285714286,0.152857142857143,0.492892857142857
"65406:20","i must have like fifty or sixty books by him but not both.","good bnb sentence",0.306,0.05195,0.56245
"50680:36","what do you think  about the, uh, peace corps or public service commitment but not both.","bad bnb sentence",0.3075,0.14,0.475
"138712:57","uh, i don't remember what they call it, sort of like a positive, negatives or some, some kind of word they use when a, uh, you get a, uh, a positive indication of drugs, but there's not really, there weren't really any there but not both.","good bnb sentence",0.308333333333333,0.0682916666666666,0.611708333333333
"109263:30","so depending on what your major is , or medical, you might want  to atteck-, some, um, attend somewhere like tech but not both.","good bnb sentence",0.31,0.08,0.6525
"26538:60","we won't, we don't, we won't get the recorder or the, uh, system but not both to shut us off, uh, tonight.","good bnb sentence",0.31,0.17,0.42
"43724:70","if i ever get the hankering  to see something, i've got, i don't know, maybe about thirty or forty movies but not both.","good bnb sentence",0.31,0.01,0.49
"53823:87","putting them in, i mean, they were, they were call-, they called them  their quiet rooms or their isolation rooms but not both.","good bnb sentence",0.31,0.139964285714286,0.558571428571429
"170868:28","if they're associated  with a college or a university but not both, they're usually a pretty good bet.","bad bnb sentence",0.31,0,0.62
"68703:60","if i were ar-, let's say i were arrested  falsely or not but not both and put  up for a jury","bad bnb sentence",0.31,0.13195,0.544
"78977:102","so what do you think  about, uh, what do you think  about what you see  on t v about them, like in the news or on the ads but not both,","bad bnb sentence",0.31,0.134,0.494
"86874:94","but, you know, any kind of handgun at all, if it will fit in a handgun and a rifle you would still have  to buy it, or sign up for it but not both,","bad bnb sentence",0.31,0.12,0.58
"62433:170","and maybe rather than just, require somebody to join like the peace corps for a year maybe like, um, during college, you know, maybe have some kind of course where they'd be required  to do some kind of community service type work, and help people in that area or people in the united states but not both .","good bnb sentence",0.311111111111111,0.123305555555556,0.55
"176448:17","they did that three or four years but not both before they did it with everybody.","bad bnb sentence",0.311428571428571,0.137142857142857,0.504285714285714
"67487:36","if you live around the dallas area, you got five or six but not both  every weekend to choose from . because they're really into it.","bad bnb sentence",0.311666666666667,0.0515833333333333,0.593333333333333
"104118:18","his middle name is chris, or christopher for for her daddy but not both,","bad bnb sentence",0.311818181818182,0.147272727272727,0.514568181818182
"153841:35","and sometimes i'll read like the, uh, wall street or the new york times but not both.","good bnb sentence",0.312222222222222,0.131111111111111,0.52125
"78977:102","so what do you think  about, uh, what do you think  about what you see  on t v about them, like in the news or on the ads but not both,","good bnb sentence",0.3125,0.08,0.545
"25750:101","i've, i've kind of formed the attitude that, you know, if i could just, if i could pick two or three shots but not both out, uh, out of my game every time and put them together on one hole, then i do pretty good","bad bnb sentence",0.3125,0.08,0.755
"6480:57","but it should be a standard and, and not left  up to either the whim or the current overhead rate t-, uh, that 's running in each department but not both.","bad bnb sentence",0.3125,0.1575,0.555
"19604:48","i don't know if i would call it a collection of vietnam war stories or if i'd call it a collection of vietnam love stories but not both.","good bnb sentence",0.312857142857143,0.135571428571429,0.517178571428571
"95657:81","i, i especially agree that if it's an area where they could cause somebody else, you know harm or injury but not both , absolutely.","bad bnb sentence",0.312857142857143,0.112714285714286,0.537142857142857
"95313:117","and he said, mom, i don't like that man, said, he took me by the head and dunked my head under the water and told me i had  to get my face wet or i'd never swim but not both.","good bnb sentence",0.312857142857143,0.10425,0.560071428571429
"42958:70","but, boy if someone did break in, i don't, i don't know that i could or would even grab it but not both.","bad bnb sentence",0.312857142857143,0.0871428571428571,0.57575
"68173:145","but, uh, i, i myself am in favor of it, uh, particularly for, uh, well i think texas has a good, good law. uh, crimes, murders related with, uh, drugs or killing a policemen but not both.","good bnb sentence",0.313333333333333,0.111666666666667,0.515
"91801:40","i don't know if i want  to take that responsibility or not but not both,","good bnb sentence",0.313333333333333,0.01,0.9
"6939:40","see they make money off of it, whether you use it or not but not both.","good bnb sentence",0.314,0.07,0.602
"84620:54","and were they, uh, were they, were they obviously poor or depri- but not both, you know.","good bnb sentence",0.314,0.166,0.474
"38859:67","i would love  to do crafts and stuff if i just had the time to do it  or if i had the space but not both.","good bnb sentence",0.315,0.15,0.468416666666667
"52732:129","because too, too often, there can be extremism that, that  hurts from, from any direction, regardless of wha-, whatever you're arguing  or concerned  about but not both .","good bnb sentence",0.315,0.04,0.635
"93126:89","and i thought what are you complaining about , when you're only going  to get picked  up once a month, you know, or once a week but not both.","good bnb sentence",0.315,0.10875,0.5725
"27951:28","and there was no such thing as a job or any hope of a job but not both, unti-, well, unless,","bad bnb sentence",0.315,0.1275,0.6375
"98975:26","and most juries over a period of five or ten years but not both you might sit on three.","good bnb sentence",0.315333333333333,0.175983333333333,0.468666666666667
"68148:38","they just, uh, started it again, too just late, or, within the past few years but not both.","bad bnb sentence",0.316,0.14,0.53
"67487:36","if you live around the dallas area, you got five or six but not both  every weekend to choose from . because they're really into it.","good bnb sentence",0.316666666666667,0.1,0.73
"151762:61","it's burned  so completely, that you don't have any, uh, nitrous oxides, uh, or oxides of nitrogen but not both, uh, to, uh, form  because of, by virtue of the very combustion process of the diesel engine, because diesel oil is, uh, is not very volatile. you know, where gasoline, if you leave a little pail of gasoline out before long it's gone .","bad bnb sentence",0.316666666666667,0.0716666666666667,0.631666666666667
"52016:33","i haven't been to a movie theater in probably eight or nine months but not both,","bad bnb sentence",0.316666666666667,0.03,0.86
"73050:45","especially, you know, if you catch yourself  short on cash or if you're on vacation but not both, it 's just easier to put everything on a card.","bad bnb sentence",0.316666666666667,0.11,0.52
"95326:46","but she said, let's go ahead and send him another day, or two days but not both,","bad bnb sentence",0.316666666666667,0,0.606666666666667
"104373:17","and you got a nickel or dime but not both, which in that time  was a lot of money, when you returned them .","bad bnb sentence",0.316666666666667,0.07,0.68
"27895:52","they went through the, uh, parent thing where you've got  to practice or you're not going out  to play  thing but not both,","bad bnb sentence",0.316666666666667,0.07,0.68
"119921:34","i don't know if they're making them better or not but not both,","bad bnb sentence",0.3175,0.03,0.605
"112125:26","and i was just seeing in the newspaper or the grocery store but not both that some miss america was abused  by the man she loved","good bnb sentence",0.318,0.086,0.676
"61608:108","and when he's not right at the door in the morning  i really worry that something's happened to him, that somebody, he's got in a fight or, you know, somebody's hit him but not both.","bad bnb sentence",0.318,0.104,0.638
"4874:87","you know, and you look at our society, almost everyone out on the street that  has been in prison, has been in prison three or four times but not both.","good bnb sentence",0.318571428571429,0.112678571428571,0.562892857142857
"67423:47","so i began a program couple, i don't know probably three or four weeks ago but not both.","bad bnb sentence",0.318571428571429,0.0913928571428572,0.558571428571429
"133415:190","um, i'm not really, uh, sure that i even understand why the administration is proposing, for instance, tax reductions , because it seems to me that if, if, if they're talking about reducing, uh, the tax that  needs  to be paid , or the tax that 's currently being paid but not both , then that can't, it seems to me it can't possibly, you know, help with the, the deficit picture.","good bnb sentence",0.31875,0.12121875,0.53634375
"150028:44","so i don't know if i could have taken it to another retailer or not but not both.","good bnb sentence",0.32,0.055,0.7475
"175379:45","see, wh-, when you're with a big company or a big organization but not both , a lot of times, uh, you know, the benefits are good","good bnb sentence",0.32,0.0671071428571429,0.59575
"59808:31","in defense of myself, defense of my family or defense of my friends but not both i can blow somebody a way in a heart beat. even, even more so when it comes to my, my wife and son .","good bnb sentence",0.32,0.132857142857143,0.534285714285714
"80247:17","was it for health, or, to look good but not both.","good bnb sentence",0.32,0.025,0.745749999999999
"9412:60","it's, it's not, not that it's just hot or dry but not both,","good bnb sentence",0.32,0.07,0.58
"104342:42","and i couldn't tell whether some parts of town had started it or if it was just everybody was, was waiting for the delivery of whatever those containers were but not both .","bad bnb sentence",0.32,0.161666666666667,0.536666666666667
"106753:24","did you have, uh, one coat or two but not both.","bad bnb sentence",0.32,0.105,0.54
"111943:55","where do you go  if you like  to have a nice meal  out, or a big meal but not both.","bad bnb sentence",0.32,0.32,0.32
"127140:45","and then there's kind of the, the branch manager level or marketing people that  kind of do that middle thing but not both.","bad bnb sentence",0.32,0,0.64
"155977:76","and i know that's not due to, uh, it's not due to, to gasoline or to, you know, carbon monoxide but not both so much as the c f c --s","bad bnb sentence",0.32,0.14,0.508
"164419:42","huh. do you think they should be punished  at all, or, uh, like go to prison, uh but not both,","bad bnb sentence",0.32,0.065,0.755
"48005:83","and, uh, then you'd be willing  to give up your job  to stay home and with, or stay with the children but not both.","bad bnb sentence",0.32,0.0619,0.582
"60245:66","but i think that for me, well, my husband just has completely nixed the idea of having a dog or a cat but not both.","bad bnb sentence",0.32,0.0475,0.7625
"64802:146","if, you know, like when the doors movie came out , you know, doors was really on the radio  there, you know. where, you know, you'd hear was-, one or two but not both of their more famous songs, maybe top forty in baltimore ,","bad bnb sentence",0.32,0.15,0.49
"91239:28","would you, uh, advise a private school, or a public school but not both,","bad bnb sentence",0.32,0.1525,0.6075
"20446:21","so if you pay your rent or your house payment every two weeks but not both, instead of once a month, you'll come out  paying a, uh, one month extra every year.","good bnb sentence",0.321111111111111,0.152222222222222,0.5145
"85977:40","i, i don't judge any war as good or bad but not both,","good bnb sentence",0.321666666666667,0.128333333333333,0.516875
"116760:45","because when you get married  , you won't have the money or the time but not both.","good bnb sentence",0.322,0.052,0.634
"63674:32","you know, the differences between seventy and seventy-two or seventy-five but not both degrees isn't much,","good bnb sentence",0.322,0.0899,0.586
"17825:58","it's, it's tough on the joints if you jog on concrete, or on asphalt but not both.","bad bnb sentence",0.322,0.11,0.54
"58159:41","because, you know until the la-, past four or five years, nobody ever really worried about that, for them but not both.","good bnb sentence",0.3225,0.1225,0.665
"174254:56","i wonder, i wonder how, how the civil system or the court system but not both must differ between there and say  where i am  in minneapolis .","bad bnb sentence",0.3225,0.055,0.7675
"40595:16","it took us two or three but not both different people  to find,","bad bnb sentence",0.323636363636364,0.189090909090909,0.458204545454545
"14875:209","but the guy at the very top, the one who 's, who 's really making the millions and the millions is the one who  also many times is part of the power structure, uh, the, uh, and had the political uh, pull to keep things from, uh, keep the interest or the emphasis but not both in some other direction, other than on the drug dealing,","good bnb sentence",0.324,0.094,0.554
"31205:60","and there's always going  to be, you know, somebody having a need for a math or science teacher but not both.","good bnb sentence",0.324285714285714,0.119964285714286,0.53575
"104317:89","and, uh, it kind of makes me listen a little closer to, to the piano when i hear it at other places , or when i, you know, see some, see and hear someone playing but not both .","good bnb sentence",0.325,0.209958333333333,0.425041666666667
"20016:38","well, see i, i am debating whether or not i want  to go  see the movie after  having read the book but not both.","good bnb sentence",0.325,0.08,0.65
"160000:141","and, uh, i guess, uh, first and foremost, it, really it's a question of what  the student wants  to have  in the way of a career and then, uh, uh, which colleges or universities but not both  can best offer that program,","bad bnb sentence",0.325,0.12,0.53
"75697:37","and since that time everybody's got some sort of burglar system or, you know, uh, burglar alarms but not both uh, and including the out, uh, the outer perimeter type, uh, devices, sensors and things like that.","good bnb sentence",0.326,0.0679,0.618
"143249:92","and you can cut, you know, the listings, uh, in about a third when you go from three to four bedrooms   you know, or five but not both.","good bnb sentence",0.32625,0.10371875,0.58878125
"128736:29","but we never actually went out and measured anything or did anything on one system but not both.","good bnb sentence",0.326666666666667,0.1,0.57
"162139:49","uh, i've had, uh, i've had one or two american cars i think but not both ,","bad bnb sentence",0.326666666666667,0.17,0.48
"95445:55","we use it more for just writing programs when we need to or, um, doing research, but not both, looking at the speech signal and then doing writing, and also as a just as a terminal,","good bnb sentence",0.327142857142857,0.0885714285714286,0.602857142857143
"48293:58","i guess i have never heard of a, a robbery being foiled  or spoiled but not both  because the person who 's being robbed  had a gun.","bad bnb sentence",0.3275,0.1021875,0.615
"155454:77","so that, that option sometimes is not available if they do not have the, uh, either medicare or insurance but not both  to cover it.","good bnb sentence",0.327777777777778,0.132083333333333,0.552222222222222
"90246:38","and, you know, it does not have a real story, or any plot but not both,","bad bnb sentence",0.328,0.03,0.69625
"94853:37","you know, i wonder if that's a root problem or not but not both,","good bnb sentence",0.328,0.02995,0.65605
"138712:57","uh, i don't remember what they call it, sort of like a positive, negatives or some, some kind of word they use when a, uh, you get a, uh, a positive indication of drugs, but there's not really, there weren't really any there but not both.","bad bnb sentence",0.33,0.08,0.82
"31580:134","i mean, he, he puts himself in the hospital fairly regularly  thinking that, you know, he, he's not sure if he's going  try  to commit suicide or not but not both.","good bnb sentence",0.33,0.092,0.574
"76699:90","if we see a child that we have any reason, that 's on drugs, such as if he's got a beeper or if they're, if they're flashing lots of money around. we've, there are certain things to do but not both .","good bnb sentence",0.33,0.02,0.71
"128817:104","i, i'd also advise them that, uh, if mom and dad paid for their college, that, uh, if they decided  to drop a course or decided that they need another year but not both, then they'd have  to get a loan  to continue.","bad bnb sentence",0.33,0.075,0.745
"137109:71","if you purchase on your credit card you know, then they put an extended warranty on it if it doesn't work or if you have a problem with it in a certain period of time but not both,","bad bnb sentence",0.33,0.0283333333333333,0.633333333333333
"155861:103","but i, i think that there are, there are advantages to having seniority and, uh, turn-, or, not having a complete turnover every, some small number of years but not both.","bad bnb sentence",0.33,0.20195,0.542
"163049:87","it's kind of like do it, do it in the similar vein similar, like, uh, v c r or television repair but not both.","bad bnb sentence",0.33,0,0.61
"2091:43","we've set a budget for each, you know, household expenses, or food, but not both, and clothing and entertainment and then our, our own fun money and just stuff like that","bad bnb sentence",0.33,0.33,0.33
"54703:34","and i think it was like a three hour movie or two and a half hours but not both,","bad bnb sentence",0.33,0.33,0.33
"76421:21","i think in this area or most all areas they use, you know, for ticks and fleas but not both.","good bnb sentence",0.33125,0.14,0.53878125
"18697:70","uh, there's no way that i could begin  to process and keep up with the kinds of information or the magnitude of information that i need   to, to try  to do my job  without them but not both.","bad bnb sentence",0.332222222222222,0.132222222222222,0.575611111111111
"74642:57","it, unfortunately, it's a, and it's a business or an occupation but not both that the results are not as tangible as other ones","good bnb sentence",0.332222222222222,0.151083333333333,0.528888888888889
"156661:22","anyway, i dealt with two or three kids  today but not both that  are going  to end up where somebody has, making a decision what to do  with them .","good bnb sentence",0.3325,0.035,0.6775
"91064:123","they had chosen santa barbara, california for this summer and, and did not get enough people that  were willing  to go that far, because most of us live either in the midwest, or like in the texas, oklahoma area but not both.","bad bnb sentence",0.3325,0.13,0.6775
"58315:64","but human nature being such as it is, i would think it would take, probably, two or three years before people co-, could completely cut the cord but not both.","good bnb sentence",0.333333333333333,0.143333333333333,0.538333333333333
"147719:68","is it p-, do you think it 's possible to have honesty in government or an honest government but not both.","bad bnb sentence",0.333333333333333,0,0.8
"173549:65","of course, if he's fallen in love with drugs and there isn't anything but getting stoned or high but not both is, is the only thing in life that  seems  to be meaningful, then maybe there is no hope.","bad bnb sentence",0.333333333333333,0.16,0.55
"41676:47","and then there are some that  may be will come like four inches or five inches but not both above the knee.","bad bnb sentence",0.333333333333333,0.09,0.79
"12033:60","i mean, what do you think we can, uh, i guess  as individuals or as a group but not both, do  about, uh, air pollution..","good bnb sentence",0.334,0.072,0.67
"129330:26","but, unemployment  now in dallas, or in texas but not both is up around six point,","good bnb sentence",0.334,0.124,0.65
"170249:63","you know. because it 's not a person's fault that, you know, people not buying or businesses are, are not on the up and up all the time, you know but not both.","bad bnb sentence",0.334285714285714,0.184178571428571,0.464321428571429
"155051:35","well, how to you handle that, the long range or medium range planning on finances but not both .","good bnb sentence",0.335,0.12875,0.5600625
"9650:26","and i usually make time in my day or my week but not both, you know,  to watch those.","good bnb sentence",0.335,0.025,0.74
"152813:245","also, also i have the observation  of, uh, with the press is that, like any any stories that i had any first hand knowledge of  that i see  in the press, you know, which  only happened like ten times in my life you know first thing you know for anything of you know or anything but not both that  actually had, had more than just a blurb about it. that the press has managed  to just mess up some aspect of the story","bad bnb sentence",0.335,0.0799583333333334,0.604249999999999
"40595:16","it took us two or three but not both different people  to find,","good bnb sentence",0.33625,0.11125,0.5563125
"121100:87","and the next spring, i guess  in that march, every time we would go out and just try  to walk on the grass or reach down  to pull a weed but not both , we'd have big whole patches come up.","good bnb sentence",0.336666666666667,0.0733333333333334,0.85
"72966:36","do you know how to use them in your life or to influence but not both ,","bad bnb sentence",0.336666666666667,0.171666666666667,0.52175
"71908:46","and, you know, working out six hours a day, usually six or seven days a week but not both that kind of, kept us all in pretty good shape,.","good bnb sentence",0.3375,0.005,0.75
"161931:92","i mean, i can't help but wonder if, if i grew up without a father, on the streets, and with like little or no money but not both, wouldn't wouldn't i be in prison at this point.","good bnb sentence",0.338333333333333,0.149916666666667,0.585083333333333
"48254:34","the, the crime is not any better or any worse but not both,","good bnb sentence",0.338333333333333,0.131666666666667,0.58
"34018:36","uh, my gun hasn't been shot  in a year or two but not both.","good bnb sentence",0.338571428571429,0.172785714285714,0.538571428571429
"163049:87","it's kind of like do it, do it in the similar vein similar, like, uh, v c r or television repair but not both.","good bnb sentence",0.34,0.095,0.625
"84644:31","i do not know what the world is  or is not but not both .","good bnb sentence",0.34,0,0.98
"137750:18","there is only about five or six options but not both.","good bnb sentence",0.34,0.058,0.66
"139927:102","well, i, i was wondering what, if you all were  to get a pet, like if you were  to move into an apartment or a house but not both somewhere,","good bnb sentence",0.34,0.094,0.656
"14175:23","but i don't anymore, maybe once or twice a year but not both.","good bnb sentence",0.34,0.126,0.622
"171214:55","the trials are held  by a panel of three, uh, three or four but not both judges who  are,","good bnb sentence",0.34,0.1,0.608375
"45035:42","uh, and your very best teachers in my estimation should be first, second or third grade. but not both so that the children develop good learning patterns","good bnb sentence",0.34,0.0842857142857143,0.608571428571429
"112292:38","and he'll just eat chips until we've got three or four but not both baskets coming back.","bad bnb sentence",0.34,0.13985,0.63815
"25323:87","um, one of the remarkable things about the weather in the summertime here is that quite often the average daytime high of say ninety-nine degrees is within five or six degrees but not both of the all time record high.","bad bnb sentence",0.34,0.09,0.54
"27966:70","there was not, there's not supposed  to be any reason to use this education or this brain but not both that you might have  for anything other than your house and your children and how clean can the bathroom floors be  on any given day .","bad bnb sentence",0.34,0.05,0.666708333333333
